id,year,number,unit,topic,question_text,question_image,table_headers,option_a,option_b,option_c,option_d,option_e,correct_answer,a mark,tagged
SPEC-17,Specimen Paper,17,Particles and Waves,Interference,"\( S_1 \) and \( S_2 \) are sources of coherent waves.<br>An interference pattern is obtained between X and Y.<br>[c]{{IMAGE}}[/c]The first order maximum occurs at P, where \( S_1P\) = 200 mm and \( S_2P\) = 180 mm.<br><br>For the third order maximum, at R, the path difference \( (S_1R - S_2R) \) is",SPEC_Q17_Diagram.png,,20 mm,30 mm,40 mm,50 mm,60 mm,E,,1
SPEC-18,Specimen Paper,18,Particles and Waves,Spectra,"In an atom, a photon is emitted when an electron makes a transition from a higher energy level to a lower energy level as shown.<br>[c]{{IMAGE}}[/c]The wavelength of the radiation emitted due to an electron transition between the two energy levels shown is",SPEC_Q18_Diagram.png,,7.31 × 10⁻⁸ m,9.12 × 10⁻⁸ m,1.21 × 10⁻⁷ m,8.23 × 10⁶ m,2.47 × 10¹⁵ m,C,,1
SPEC-19,Specimen Paper,19,Particles and Waves,Refraction of Light,"A ray of red light travels from air into water.<br><br>Which row in the table describes the change, if any, in speed and frequency of a ray of red light as it travels from air into water?",,Speed | Frequency,stays constant | decreases,increases | increases,increases | stays constant,decreases | stays constant,decreases | decreases,D,,1
SPEC-20,Specimen Paper,20,Electricity,Monitoring and Measuring AC,The rms voltage of the mains supply is 230 V.<br><br>The approximate value of the peak voltage is,,,115 V,163 V,325 V,460 V,651 V,C,,1
SPEC-21,Specimen Paper,21,Electricity,Monitoring and Measuring AC,An oscilloscope is connected to the output terminals of a signal generator.<br>The trace displayed on the screen is shown.<br>[c]{{IMAGE}}[/c]The timebase of the oscilloscope is set at 30 ms/div.<br><br>The frequency of the output signal from the signal generator is,SPEC_Q21_Diagram.png,,4.2 × 10⁻³ Hz,8.3 × 10⁻³ Hz,0.12 Hz,4.2 Hz,8.3 Hz,E,,1
SPEC-22,Specimen Paper,22,Electricity,"Current, Potential Difference, Power, and Resistance","In the diagrams below, each resistor has the same resistance.<br><br>Which combination has the least value of the effective resistance between the terminals X and Y?",,,[IMG]SPEC_Q22_A.png,[IMG]SPEC_Q22_B.png,[IMG]SPEC_Q22_C.png,[IMG]SPEC_Q22_D.png,[IMG]SPEC_Q22_E.png,A,,1
SPEC-23,Specimen Paper,23,Electricity,"Current, Potential Difference, Power, and Resistance",Four resistors each of resistance 20 Ω are connected to a 60 V supply of negligible internal resistance as shown.<br>[c]{{IMAGE}}[/c]The potential difference across PQ is,SPEC_Q23_Diagram.png,,12 V,15 V,20 V,24 V,30 V,A,,1
SPEC-24,Specimen Paper,24,Electricity,Electrical Sources and Internal Resistance,The EMF of a battery is,,,the total energy supplied by the battery,the voltage lost due to the internal resistance of the battery,the total charge that passes through the battery,the number of coulombs of charge passing through the battery per second,the energy supplied to each coulomb of charge passing through the battery,E,,1
SPEC-25,Specimen Paper,25,Electricity,Capacitors,A student carries out three experiments to investigate the charging of a capacitor using a DC supply.<br>The graphs obtained from the experiments are shown.<br>[c]{{IMAGE}}[/c]The axes of the graphs have not been labelled.<br><br>Which row in the table shows the labels for the axes of the graphs?,SPEC_Q25_Diagram.png,Graph 1 | Graph 2 | Graph 3,voltage and time | charge and voltage | current and time,current and time | voltage and time | charge and voltage,current and time | charge and voltage | voltage and time,voltage and time | current and time | charge and voltage,charge and voltage | current and time | voltage and time,D,,1
RH15-02,2015 Revised Higher,2,Our Dynamic Universe,"Forces, Energy and Power",The mass of a car is 900 kg. The car is being towed at a steady speed of 4.0 m s⁻¹. The tow rope breaks and the car travels a further 6.0 m in a straight line before coming to rest.<br><br>The magnitude of the average unbalanced force acting on the car while coming to rest is,,,600 N,1200 N,1350 N,3600 N,5400 N,B,1,1
RH15-03,2015 Revised Higher,3,Our Dynamic Universe,"Collisions, Explosions and Impulse",A student makes the following statements about elastic and inelastic collisions.<br>[s]I In an elastic collision kinetic energy is conserved but momentum is not conserved.<br>II In an inelastic collision both kinetic energy and momentum are conserved.<br>III In an inelastic collision momentum is conserved but kinetic energy is not conserved.[/s]Which of the statements is/are correct?,,,I only,II only,III only,I and II only,I and III only,C,,1
RH15-04,2015 Revised Higher,4,Our Dynamic Universe,Gravitation,The distance between a spacecraft and a space station is 0.45 km.<br>The mass of the spacecraft is 1.08 × 10⁵ kg.<br>The mass of the space station is 3.44 × 10⁵ kg.<br><br>The gravitational force between the spacecraft and the space station is,,,1.8 × 10⁶ N,5.5 N,1.2 × 10⁻¹ N,5.5 × 10⁻³ N,1.2 × 10⁻³ N,E,,1
RH15-06,2015 Revised Higher,6,Our Dynamic Universe,The Expanding Universe,"The siren on a police car emits sound which alternates between two different frequencies.<br>The police car moves at a steady speed as it approaches, passes and moves away from a stationary pedestrian.<br><br>Which graph shows how the frequency \( f \) of the sound heard by the pedestrian varies with time \( t \)?",,,[IMG]RH15_Q06_A.png,[IMG]RH15_Q06_B.png,[IMG]RH15_Q06_C.png,[IMG]RH15_Q06_D.png,[IMG]RH15_Q06_E.png,E,1,1
RH15-07,2015 Revised Higher,7,Our Dynamic Universe,The Expanding Universe,The graph shows how the energy emitted per second from an object varies with the wavelength of the radiation emitted by the object.<br>[c]{{IMAGE}}[/c]The temperature of the object is increased.<br><br>Which graph shows how the energy emitted per second now varies with the wavelength of the radiation?,RH15_Q07_Diagram.png,,[IMG]RH15_Q07_A.png,[IMG]RH15_Q07_B.png,[IMG]RH15_Q07_C.png,[IMG]RH15_Q07_D.png,[IMG]RH15_Q07_E.png,B,,1
RH15-08,2015 Revised Higher,8,Particles and Waves,The Standard Model,A student makes the following statements about a proton.<br>[s]I A proton is a fermion.<br>II A proton is a baryon.<br>III A proton is a meson.[/s]Which of these statements is/are correct?,,,I only,II only,III only,I and II only,I and III only,D,,1
RH15-10,2015 Revised Higher,10,Particles and Waves,Forces on Charged Particles,"One joule of work is done in moving one coulomb of charge between two plates as shown.<br>[c]{{IMAGE}}[/c]From the information given, which of the following statements must be true?",RH15_Q10_Diagram.png,,The distance between the plates is one metre.,The capacitance of the circuit is one farad.,The current in the circuit is one ampere.,The potential difference between the plates is one volt.,The resistance of the circuit is one ohm.,D,,1
RH15-11,2015 Revised Higher,11,Particles and Waves,Wave-Particle Duality,Radiation of frequency 9.40 × 10¹⁴ Hz is incident on a clean metal surface.<br>The work function of the metal is 3.78 × 10⁻¹⁹ J.<br><br>The maximum kinetic energy of an emitted photoelectron is,,,2.45 × 10⁻¹⁹ J,3.78 × 10⁻¹⁹ J,6.23 × 10⁻¹⁹ J,2.49 × 10³³ J,1.00 × 10⁻¹⁸ J,A,,1
RH15-15,2015 Revised Higher,15,Particles and Waves,Inverse Square Law,A small lamp is placed 0.50 m above the surface of a desk.<br>[c]{{IMAGE}}[/c]There is no other source of light.<br>The lamp is now moved until the irradiance at the desk surface is halved.<br><br>The new distance of the lamp above the desk surface is approximately,RH15_Q15_Diagram.png,,0.7 m,1.0 m,1.4 m,1.5 m,2.0 m,A,,1
RH15-18,2015 Revised Higher,18,Electricity,Monitoring and Measuring AC,The heating element of an electric kettle has a resistance of 30 Ω.<br>The kettle is connected to an a.c. power supply. The r.m.s. voltage of the supply is 230 V.<br><br>The peak value of the current in the element is,,,0.1 A,0.2 A,5.4 A,7.7 A,10.8 A,E,,1
RH15-20,2015 Revised Higher,20,Other,Skills,A student makes measurements of the time taken for sound to travel various distances in air.<br>The measurements are used to produce the following graph.<br>[c]{{IMAGE}}[/c]The student makes the following statements.<br>[s]I The graph proves that the distance travelled is directly proportional to the time taken.<br>II The graph indicates that there is a systematic uncertainty in the measurements.<br>III The speed of sound can be calculated from the gradient of the graph.[/s]Which of these statements is/are correct?,RH15_Q20_Diagram.png,,I only,I and II only,I and III only,II and III only,"I, II and III",D,1,1
RH14-01,2014 Revised Higher,1,Our Dynamic Universe,Motion - Equations and Graphs,A ball moves down a frictionless slope from X to Y.[c]{{IMAGE}}[/c]Which graph shows how the acceleration \(a\) of the ball varies with time \(t\) as it moves down the slope?,RH14_Q01_Diagram.png,,[IMG]RH14_Q01_A.png,[IMG]RH14_Q01_B.png,[IMG]RH14_Q01_C.png,[IMG]RH14_Q01_D.png,[IMG]RH14_Q01_E.png,A,,1
RH14-02,2014 Revised Higher,2,Our Dynamic Universe,Motion - Equations and Graphs,A boat is moving at a speed of 6.0 m s⁻¹. The boat now accelerates at 3.0 m s⁻² until it reaches a speed of 12 m s⁻¹.<br><br>The distance travelled by the boat during this acceleration is,,,6.0 m,18 m,30 m,36 m,54 m,B,,1
RH14-03,2014 Revised Higher,3,Our Dynamic Universe,"Collisions, Explosions and Impulse",The graph shows how the force acting on an object of mass 5.0 kg varies with time.[c]{{IMAGE}}[/c]The change in momentum of the object is,RH14_Q03_Diagram.png,,7.0 kg m s⁻¹,30 kg m s⁻¹,35 kg m s⁻¹,60 kg m s⁻¹,175 kg m s⁻¹,C,,1
RH14-04,2014 Revised Higher,4,Our Dynamic Universe,Special Relativity,A spaceship is moving with a constant speed of 0.6\(c\) towards the Earth.<br>The spaceship emits a beam of light towards the Earth. An astronaut in the spaceship and an observer on Earth both measure the speed of the emitted light.<br><br>Which row in the table shows the speed of the emitted light as measured by the astronaut and by the observer on Earth?,,Speed of emitted light as measured by astronaut|Speed of emitted light as measured by observer on Earth,0.4\(c\) | 1.6\(c\),\(c\) | \(c\),\(c\) | 1.6\(c\),1.6\(c\) | 0.4\(c\),1.6\(c\) | \(c\),B,,1
RH14-05,2014 Revised Higher,5,Our Dynamic Universe,The Expanding Universe,"The graph shows how the energy emitted per second from the surface of a hot object varies with the wavelength, \(\lambda\), of the emitted radiation at different temperatures.[c]{{IMAGE}}[/c]<br>A student makes the following statements based on the information shown in the graph.<br>[s]I As the temperature of the object increases, the total energy emitted per second decreases.<br>II As the temperature of the object increases, the peak wavelength of the emitted radiation decreases.<br>III The frequency of the emitted radiation steadily increases as the emitted energy per second decreases.[/s]Which of the statements is/are correct?",RH14_Q05_Diagram.png,,I only,II only,III only,I and II only,II and III only,B,,1
RH14-06,2014 Revised Higher,6,Our Dynamic Universe,The Expanding Universe,The cooling of the Universe and cosmic microwave background radiation provide evidence for,,,the photoelectric effect,the Bohr model of the atom,the theory of special relativity,the Big Bang theory,Newton's Universal Law of Gravitation,D,,1
RH14-09,2014 Revised Higher,9,Particles and Waves,Forces on Charged Particles,An electron enters a region of magnetic field as shown.[c]{{IMAGE}}[/c]The direction of the force exerted by the magnetic field on the electron as it enters the field is,RH14_Q09_Diagram.png,,to the left,into the page,out of the page,towards the top of the page,towards the bottom of the page,E,,1
RH14-10,2014 Revised Higher,10,Particles and Waves,Nuclear Reactions,An isotope of uranium decays into an isotope of protactinium in two stages as shown.<br>$${}_{92}^{238}\text{U} \xrightarrow{\text{stage 1}} {}_{90}^{234}\text{Th} \xrightarrow{\text{stage 2}} {}_{91}^{234}\text{Pa}$$<br>Which row in the table identifies the radiations which must be emitted at each stage?,,stage 1|stage 2,alpha | gamma,beta | gamma,gamma | beta,beta | alpha,alpha | beta,E,,1
RH14-11,2014 Revised Higher,11,Particles and Waves,Nuclear Reactions,The following statement represents a fission reaction.<br>$${}_{92}^{235}\text{U} + {}_{0}^{1}\text{n} \rightarrow {}_{57}^{139}\text{La} + {}_{42}^{95}\text{Mo} + 2{}_{0}^{1}\text{n} + 7_{-1}^{0}\text{e}$$The total mass of the particles before the reaction is 391.848 × 10⁻²⁷ kg.<br>The total mass of the particles after the reaction is 391.478 × 10⁻²⁷ kg.<br>The energy released in this reaction is,,,3.53 × 10⁻⁸ J,3.52 × 10⁻⁸ J,3.33 × 10⁻¹¹ J,1.67 × 10⁻¹¹ J,1.11 × 10⁻¹⁹ J,C,,1
RH14-12,2014 Revised Higher,12,Particles and Waves,Interference,"The spectrum of white light from a filament lamp may be viewed using a prism or a grating.<br>A student, asked to compare the spectra formed by the two methods, makes the following statements.<br>[s]I The prism produces a spectrum by refraction and the grating produces a spectrum by interference.<br>II The spectrum formed by the prism consists of all the wavelengths present in the white light and the spectrum formed by the grating consists of only a few specific wavelengths.<br>III The prism produces a single spectrum and the grating produces more than one spectrum.[/s]Which of the statements is/are correct?",,,I only,II only,I and II only,I and III only,"I, II and III",D,1,1
RH14-13,2014 Revised Higher,13,Particles and Waves,Refraction of Light,The diagram shows the path of a ray of red light as it passes from air into substance X.[c]{{IMAGE}}[/c]The critical angle for the light in substance X is,RH14_Q13_Diagram.png,,32°,41°,45°,52°,90°,B,,1
RH14-14,2014 Revised Higher,14,Particles and Waves,Inverse Square Law,"The irradiance of light from a point source is 160 units at a distance of 0.50 m from the source.<br><br>At a distance 2.0 m from this source, the irradiance is",,,160 units,80 units,40 units,10 units,5 units,D,,1
RH14-16,2014 Revised Higher,16,Electricity,"Current, Potential Difference, Power, and Resistance",Five resistors are connected as shown.[c]{{IMAGE}}[/c]<br>The resistance between X and Y is,RH14_Q16_Diagram.png,,12 Ω,20 Ω,30 Ω,60 Ω,180 Ω,B,,1
RH14-17,2014 Revised Higher,17,Electricity,"Current, Potential Difference, Power, and Resistance",A circuit is set up as shown.[c]{{IMAGE}}[/c]<br>The internal resistance of the supply is negligible.<br><br>Which row in the table shows the potential difference (p.d.) across the 12 Ω resistor when switch S is open and when S is closed?,RH14_Q17_Diagram.png,p.d. across 12 Ω resistor when S is open / V|p.d. across 12 Ω resistor when S is closed / V,30 | 18,45 | 45,60 | 45,60 | 72,72 | 60,D,,1
RH14-18,2014 Revised Higher,18,Electricity,Semiconductors and p-n Junctions,"The letters X, Y and Z represent missing words from the following passage.<br>[s]Solids can be divided into 3 broad categories: conductors, insulators and semiconductors.<br>In ...X... the conduction band is not completely full and this allows electrons to move easily.<br>In ...Y... the valence band is full.<br>In ...Z... electrons can move from the valence to the conduction band at room temperature.[/s]Which row in the table shows the missing words?",,X|Y|Z,conductors | insulators | semiconductors,semiconductors | insulators | conductors,insulators | semiconductors | conductors,conductors | semiconductors | insulators,insulators | conductors | semiconductors,A,,1
RH14-19,2014 Revised Higher,19,Electricity,Semiconductors and p-n Junctions,"A student makes the following statements about p-n junction devices.<br>[s]I In solar cells, a potential difference is produced when photons are incident on the junction.<br>II The photovoltaic effect occurs in solar cells.<br>III In LEDs, photons are emitted from the junction when a current is passed through it.[/s]Which of these statements is/are correct?",,,I only,III only,I and II only,I and III only,"I, II and III",E,,1
RH14-20,2014 Revised Higher,20,Other,Uncertainties,A ball is dropped several times from the same height.<br>A student records the following times for the ball to reach the ground.<br><br>[c]1.15 s  1.13 s  1.09 s  1.13 s  1.05 s[/c]<br>Which row in the table shows the mean time for the ball to reach the ground and the approximate random uncertainty in this mean?,,Mean time / s|Approximate random uncertainty / s,1.11 | 0.02,1.11 | 0.10,1.13 | 0.02,1.13 | 0.10,4.71 | 0.94,A,,1
RH13-02,2013 Revised Higher,2,Our Dynamic Universe,Motion - Equations and Graphs,An object starts from rest and accelerates in a straight line.<br>The graph shows how the acceleration of the object varies with time.<br>[c]{{IMAGE}}[/c]The speed of the object at 5 seconds is,RH13_Q02_Diagram.png,,2 m s⁻¹,8 m s⁻¹,12 m s⁻¹,16 m s⁻¹,20 m s⁻¹,B,,1
RH13-03,2013 Revised Higher,3,Other,Uncertainties,"A vehicle runs down a slope as shown.<br>[c]{{IMAGE}}[/c]The following results are obtained.<br><br>angle of slope, \( \theta \) = 15.0 ± 0.5°<br>length of card on top of vehicle, \( d \) = 0.020 ± 0.001 m<br>time for card to pass light gate 1, \( t_1 \) = 0.40 ± 0.01 s<br>time for card to pass light gate 2, \( t_2 \) = 0.25 ± 0.01 s<br>time for vehicle to travel between the light gates, \( t_3 \) = 0.50 ± 0.01 s<br><br>Which quantity has the largest percentage uncertainty?",RH13_Q03_Diagram.png,,\( \theta \),\( d \),\( t_1 \),\( t_2 \),\( t_3 \),B,,1
RH13-05,2013 Revised Higher,5,Our Dynamic Universe,"Forces, Energy and Power",A box is placed on a horizontal surface.<br>A force of 15 N acts on the box as shown.<br>[c]{{IMAGE}}[/c]Which entry in the table shows the horizontal and vertical components of the force?,RH13_Q05_Diagram.png,Horizontal component/N|Vertical component/N,\( 15 \sin 60^{\circ} \) | \( 15 \sin 30^{\circ} \),\( 15 \cos 60^{\circ} \) | \( 15 \sin 30^{\circ} \),\( 15 \sin 60^{\circ} \) | \( 15 \cos 60^{\circ} \),\( 15 \cos 30^{\circ} \) | \( 15 \sin 30^{\circ} \),\( 15 \cos 60^{\circ} \) | \( 15 \sin 60^{\circ} \),E,,1
RH13-06,2013 Revised Higher,6,Our Dynamic Universe,"Collisions, Explosions and Impulse",A cannon of mass 2.0 × 10³ kg fires a cannonball of mass 5.00 kg.<br>The cannonball leaves the cannon with a speed of 50.0 m s⁻¹.<br><br>The speed of the cannon immediately after firing is,,,0.125 m s⁻¹,8.00 m s⁻¹,39.9 m s⁻¹,40.1 m s⁻¹,200 m s⁻¹,A,,1
RH13-07,2013 Revised Higher,7,Our Dynamic Universe,Gravitation,"A rock of mass 0.80 kg falls towards the surface of a planet.<br>The graph shows how the gravitational field strength, \( g \), of the planet varies with height, \( h \), above the surface of the planet.<br>[c]{{IMAGE}}[/c]At one point during its fall the weight of the rock is 4.0 N.<br><br>The height of this point above the surface of the planet is",RH13_Q07_Graph.png,,15 km,80 km,105 km,130 km,255 km,B,1,1
RH13-08,2013 Revised Higher,8,Our Dynamic Universe,The Expanding Universe,An astronomer observes the spectrum of light from a star. The spectrum contains the emission lines for hydrogen.<br>The astronomer compares this spectrum with the spectrum from a hydrogen lamp.The line which has a wavelength of 656 nm from the lamp is found to be shifted to 663 nm in the spectrum from the star.<br><br>The redshift of the light from this star is,,,0.011,0.5,0.99,2,94,A,,1
RH13-09,2013 Revised Higher,9,Our Dynamic Universe,The Expanding Universe,A train is travelling at a constant speed of 16.0 m s⁻¹ as it approaches a bridge.<br>[c]{{IMAGE}}[/c]A horn on the train emits sound of frequency 277 Hz.<br>The sound is heard by a person standing on the bridge.<br>The speed of sound in air is 340 m s⁻¹.<br><br>The frequency of the sound heard by the person on the bridge is,RH13_Q09_Diagram.png,,265 Hz,277 Hz,291 Hz,357 Hz,361 Hz,C,,1
RH13-10,2013 Revised Higher,10,Particles and Waves,The Standard Model,Three students each make a statement about antiparticles.<br>[s]I An antiparticle has the same mass as its equivalent particle.<br>II An antiparticle has the same charge as its equivalent particle.<br>III Every elementary particle has a corresponding antiparticle.[/s]Which of the statements is/are correct?,,,I only,II only,I and III only,II and III only,"I, II and III",C,,1
RH13-11,2013 Revised Higher,11,Particles and Waves,Forces on Charged Particles,"A student writes the following statements about electric fields.<br>[s]I There is a force on a charge in an electric field.<br>II When an electric field is applied to a conductor, the free electric charges in the conductor move.<br>III Work is done when a charge is moved in an electric field.[/s]Which of the statements is/are correct?",,,I only,II only,I and II only,I and III only,"I, II and III",E,,1
RH13-12,2013 Revised Higher,12,Particles and Waves,Nuclear Reactions,Part of a radioactive decay series is shown in the diagram.<br>The symbols \( X_1 \) to \( X_5 \) represent nuclides in this series.<br>[c]{{IMAGE}}[/c]A student makes the following statements about the decay series.<br>[s]I Nuclides \( X_2 \) and \( X_3 \) contain the same number of protons.<br>II Nuclide \( X_1 \) decays into nuclide \( X_2 \) by emitting an alpha particle.<br>III Nuclide \( X_3 \) decays into nuclide \( X_4 \) by emitting a beta particle.[/s]Which of these statements is/are correct?,RH13_Q12_Diagram.png,,I only,II only,III only,II and III only,"I, II and III",D,,1
RH13-13,2013 Revised Higher,13,Particles and Waves,Wave-Particle Duality,Ultraviolet radiation causes the emission of photoelectrons from a zinc plate.<br>The irradiance of the ultraviolet radiation on the zinc plate is increased.<br><br>Which row in the table shows the effect of this change?,,Maximum kinetic energy of a photoelectron|Number of photoelectrons emitted per second,increases | no change,no change | increases,no change | no change,increases | increases,decreases | increases,B,,1
RH13-14,2013 Revised Higher,14,Other,Skills,All particles exhibit wave properties.<br>The momentum \( p \) of a particle is inversely proportional to its wavelength \( \lambda \).<br><br>Which of the following graphs shows the relationship between \( p \) and \( \frac{1}{\lambda} \)?,,,[IMG]RH13_Q14_A.png,[IMG]RH13_Q14_B.png,[IMG]RH13_Q14_C.png,[IMG]RH13_Q14_D.png,[IMG]RH13_Q14_E.png,C,,1
RH13-15,2013 Revised Higher,15,Particles and Waves,Refraction of Light,"Light travels from air into glass.<br><br>Which row in the table describes what happens to the speed, frequency and wavelength of the light?",,Speed|Frequency|Wavelength,increases | decreases | stays constant,decreases | stays constant | decreases,stays constant | decreases | decreases,increases | stays constant | increases,decreases | decreases | stays constant,B,,1
RH13-16,2013 Revised Higher,16,Particles and Waves,Inverse Square Law,The irradiance of light can be measured in,,,W,W m⁻¹,W m,W m⁻²,W m²,D,,1
RH13-17,2013 Revised Higher,17,Electricity,"Current, Potential Difference, Power, and Resistance",The following circuit is set up.<br>[c]{{IMAGE}}[/c]The reading on the voltmeter is,RH13_Q17_Circuit.png,,0 V,2 V,6 V,8 V,12 V,B,,1
RH13-18,2013 Revised Higher,18,Electricity,Capacitors,"The capacitance of a capacitor is 1000 μF.<br>The potential difference (p.d.) across the capacitor is 100 V.<br>The charge stored by the capacitor is 0.10 C.<br><br>The charge on the capacitor is now reduced to half its original value.<br><br>Which row in the table shows the capacitance of the capacitor and the p.d. across the capacitor, for this new value of charge?",,Capacitance/μF|p.d./V,1000 | 200,500 | 100,1000 | 100,500 | 50,1000 | 50,E,,1
RH13-19,2013 Revised Higher,19,Electricity,Capacitors,"The graph shows how the charge, \( Q \), stored on a capacitor varies with the potential difference, \( V \), across the capacitor.<br>[c]{{IMAGE}}[/c]Which of the following statements is/are correct?<br>[s]I The gradient of the graph represents the capacitance of the capacitor.<br>II The area under the graph represents the work done in charging the capacitor.<br>III The energy, \( E \), stored in the capacitor is given by the equation \( E = QV \).[/s]",RH13_Q19_Graph.png,,I only,II only,III only,I and II only,"I, II and III",D,,1
RH13-20,2013 Revised Higher,20,Electricity,Semiconductors and p-n Junctions,"A crystal of silicon is ""doped"" with arsenic. This means that a small number of the silicon atoms are replaced with arsenic atoms.<br><br>The effect of the doping on the crystal is to",,,make it into a photodiode,make it into an insulator,increase its resistance,decrease its resistance,allow it to conduct in only one direction,D,,1
RH12-01,2012 Revised Higher,1,Our Dynamic Universe,Motion - Equations and Graphs,A trolley travels along a straight track.<br>The graph shows how the velocity  \( v \) of the trolley varies with time \( t \).[c]{{IMAGE}}[/c]Which graph shows how the acceleration \( a \) of the trolley varies with time \( t \)?,RH12_Q01_Diagram.png,,[IMG]RH12_Q01_A.png,[IMG]RH12_Q01_B.png,[IMG]RH12_Q01_C.png,[IMG]RH12_Q01_D.png,[IMG]RH12_Q01_E.png,A,,1
RH12-02,2012 Revised Higher,2,Our Dynamic Universe,"Forces, Energy and Power",A rocket of mass 200 kg accelerates vertically upwards from the surface of a planet at 2.0 m s⁻².<br>The gravitational field strength on the planet is 4.0 N kg⁻¹.<br><br>What is the size of the force being exerted by the rocket's engines?,,,400 N,800 N,1200 N,2000 N,2400 N,C,,1
