"id","year","unit","topic","question_text","question_image","table_headers","option_a","option_b","option_c","option_d","option_e","correct_answer","tagged"
"2021-13","2021","Particles and Waves","Forces on Charged Particles","Which of the following diagrams represents the electric field between a positive point charge and a negative point charge?","","","[IMG]2021_Q13_A.png","[IMG]2021_Q13_B.png","[IMG]2021_Q13_C.png","[IMG]2021_Q13_D.png","[IMG]2021_Q13_E.png","B","1"
"2021-14","2021","Particles and Waves","The Standard Model","The group of matter particles known as fermions consists of","","","baryons only","quarks only","leptons only","quarks and leptons only","baryons and mesons only","D","1"
"2021-15","2021","Particles and Waves","The Standard Model","A certain type of composite particle is made of two up quarks and a strange quark.<br><br>The charge on an up quark is \( +\frac{2}{3}e \).<br>The charge on a strange quark is \( -\frac{1}{3}e \).<br><br>Which of the following statements describes this particle?","","","The particle is a meson with a charge of +1e","The particle is a meson with a charge of -1e","The particle is a meson with no charge","The particle is a baryon with a charge of -1e","The particle is a baryon with a charge of +1e","E","1"
"2021-16","2021","Particles and Waves","Nuclear Reactions","Two changes in a radioactive decay series are shown below.<br>[c]$$ {}_{90}^{231}\text{Th} \xrightarrow{\beta} {}_{Q}^{P}\text{Pa} \xrightarrow{\alpha} {}_{S}^{R}\text{Ac} $$[/c]A Thorium nucleus emits a beta particle and the product, a Protactinium nucleus, emits an alpha particle.<br><br>Which row in the table shows the numbers represented by P, Q, R, and S?","","P | Q | R | S","231 | 89 | 227 | 87","231 | 91 | 227 | 89","227 | 88 | 227 | 87","231 | 91 | 231 | 89","227 | 88 | 223 | 86","B","1"
"2021-17","2021","Particles and Waves","Wave-Particle Duality","An experiment to demonstrate the photoelectric effect is set up as shown.<br>[c]{{IMAGE}}[/c]Which row in the table shows the charge on the metal plate and the type of incident radiation most likely to cause photoelectric emission?","2021_Q17_Diagram.png","Charge on metal plate | Type of incident radiation","negative | green light","positive | ultraviolet","negative | infrared","positive | red light","negative | ultraviolet","E","1"
"2021-18","2021","Particles and Waves","Interference","Two identical loudspeakers are connected to a signal generator as shown.<br>[c]{{IMAGE}}[/c]<br>A microphone detects a maximum of sound at position X.<br><br>The microphone is now moved from X to Y.<br><br>As the microphone is moved from X to Y, a series of maxima and minima of sound are detected.<br>The microphone detects the second minimum of sound at position Y.<br><br>The wavelength of sound emitted by the loudspeakers is","2021_Q18_Diagram.png","","0.17 m","0.24 m","0.30 m","0.40 m","0.60 m","D","1"
"2021-19","2021","Particles and Waves","Refraction of Light","A ray of red light passes from air into a transparent block as shown.<br>[c]{{IMAGE}}[/c]<br>The speed of this light in the block is","2021_Q19_Diagram.png","","1.39 x 10⁸ m s⁻¹","1.91 x 10⁸ m s⁻¹","2.62 x 10⁸ m s⁻¹","3.00 x 10⁸ m s⁻¹","4.73 x 10⁸ m s⁻¹","A","1"
"2021-20","2021","Particles and Waves","Refraction of Light","The diagram shows the path of three rays of red light P, Q and R in glass.<br>The rays are incident at the glass-air boundary as shown.<br>[c]{{IMAGE}}[/c]<br>The refractive index of the glass for this light is 1.50.<br><br>Which of these rays pass from the glass into the air at this boundary?","2021_Q20_Diagram.png","","P only","R only","Q and R only","P and Q only","P, Q and R","D","1"
"2021-21","2021","Electricity","P,V,I,R","Four resistors are connected as shown.<br>[c]{{IMAGE}}[/c]<br>The total resistance between X and Y is","2021_Q21_Diagram.png","","1.0 Ω","8.9 Ω","9.1 Ω","11 Ω","20 Ω","D","1"
"2021-22","2021","Electricity","P,V,I,R","A resistor of resistance 100 Ω is rated at 4 W.<br><br>The maximum voltage which can be applied across the resistor without exceeding its power rating is","","","0.04 V","5 V","20 V","25 V","400 V","C","1"
"2021-23","2021","Electricity","Capacitors","Capacitance is measured in farads.<br><br>One farad is equivalent to","","","one coulomb per volt","one joule per volt","one joule per coulomb","one volt per second","one joule per second","A","1"
"2021-24","2021","Electricity","Capacitors","A circuit containing a capacitor is set up as shown.<br>[c]{{IMAGE}}[/c]<br>The battery has negligible internal resistance.<br><br>The maximum charge stored by the capacitor is","2021_Q24_Diagram.png","","3.6 x 10⁻⁴ C","2.4 x 10⁻⁴ C","1.2 x 10⁻⁴ C","3.3 x 10⁻⁶ C","1.7 x 10⁻⁶ C","C","1"
"2021-25","2021","Electricity","Capacitors","A circuit is set up as shown.<br>[c]{{IMAGE}}[/c]<br>Capacitor C is initially uncharged.<br><br>Switch S is closed and the time taken for the capacitor to fully charge is recorded.<br>The switch is now opened and the capacitor is discharged.<br><br>Resistor R is replaced by a resistor of greater resistance.<br>The switch is again closed and the capacitor charges.<br><br>Which row in the table shows the effect of this change, if any, on the time taken to fully charge the capacitor and the maximum energy stored in the capacitor?","2021_Q25_Diagram.png","Time taken to fully charge the capacitor | Maximum energy stored in the capacitor","increases | increases","decreases | decreases","decreases | stays the same","increases | stays the same","stays the same | decreases","D","1"
"2019-01","2019","Our Dynamic Universe","Motion: Equations & Graphs","The graph shows how the speed \( v \) of a car varies with time \( t \).[c]{{IMAGE}}[/c]The average speed of the car during the 12.0 s is","2019_Q01_Diagram.png","","1.25 m s⁻¹","2.08 m s⁻¹","2.50 m s⁻¹","7.50 m s⁻¹","12.5 m s⁻¹","E","1"
"2019-02","2019","Our Dynamic Universe","Motion: Equations & Graphs","A stone is thrown at 50° to the horizontal with a speed of 15 m s⁻¹.[c]{{IMAGE}}[/c]Which row in the table gives the horizontal component and the vertical component of the initial velocity of the stone?","2019_Q02_Diagram.png","Horizontal component (m s⁻¹) | Vertical component (m s⁻¹)","15 sin 50 | 15 cos 50","15 cos 50 | 15 sin 50","15 cos 50 | 15 sin 40","15 cos 40 | 15 sin 50","15 sin 50 | 15 cos 40","B","1"
"2019-03","2019","Our Dynamic Universe","Motion: Equations & Graphs","A golfer strikes a golf ball, which then moves off at an angle to the ground. The ball follows the path shown.<br><br>The graphs show how the horizontal component of the velocity \( v_h \) and the vertical component of the velocity \( v_v \) of the ball vary with time \( t \).[c]{{IMAGE}}[/c]<br>The speed of the ball just before it hits the ground is","2019_Q03_Diagram.png","","10 m s⁻¹","30 m s⁻¹","40 m s⁻¹","50 m s⁻¹","70 m s⁻¹","D","1"
"2019-04","2019","Our Dynamic Universe","Motion: Equations & Graphs","A car accelerates from rest along a straight level road.<br>The acceleration of the car is constant.<br><br>Which pair of displacement-time \( (s\)-\(t) \) and acceleration-time \( (a\)-\(t) \) graphs represent the motion of the car?","","","[IMG]2019_Q04_A.png","[IMG]2019_Q04_B.png","[IMG]2019_Q04_C.png","[IMG]2019_Q04_D.png","[IMG]2019_Q04_E.png","A","1"
"2019-05","2019","Our Dynamic Universe","Forces, Energy & Power","Four masses on a horizontal, frictionless surface are linked together by strings P, Q and R.<br>A constant force is applied as shown.[c]{{IMAGE}}[/c]The tension in the strings is","2019_Q05_Diagram.png","","greatest in P and least in Q","greatest in P and least in R","greatest in R and least in Q","greatest in R and least in P","the same in P, Q and R","B","1"
"2019-06","2019","Our Dynamic Universe","Collisions, Explosions & Impulse","A student makes the following statements about an elastic collision.<br>[s]I Total momentum is conserved.<br>II Total kinetic energy is conserved.<br>III Total energy is conserved.[/s]Which of these statements is/are correct?","","","I only","II only","I and II only","I and III only","I, II and III","E","1"
"2019-07","2019","Other","Skills","The terminal velocity \( v_t \) of a skydiver is given by the relationship<br>$$v_t = \sqrt{\frac{2mg}{\rho A C_d}}$$where<br>[s]\( m \) is the mass of the skydiver in kg<br>\( g \) is the gravitational field strength in N kg⁻¹<br>\( C_d \) is the drag coefficient<br>\( \rho \) is the density of air in kg m⁻³<br>\( A \) is the area of the skydiver in m².[/s]When in freefall, a skydiver of mass 95 kg has a drag coefficient of 1.0 and a terminal velocity of 44 m s⁻¹.<br><br>The gravitational field strength is 9.8 N kg⁻¹ and the density of air is 1.21 kg m⁻³.<br>The area of the skydiver is","","","0.59 m²","0.79 m²","0.89 m²","4.2 m²","35 m²","B","1"
"2019-08","2019","Our Dynamic Universe","Special Relativity","A spacecraft is travelling at a constant speed relative to a nearby planet.<br>A technician on the spacecraft measures the length of the spacecraft as 275 m.<br>An observer on the planet measures the length of the spacecraft as 125 m.<br>The speed of the spacecraft relative to the observer on the nearby planet is","","","1.54 × 10⁴ m s⁻¹","2.22 × 10⁸ m s⁻¹","2.67 × 10⁸ m s⁻¹","3.00 × 10⁸ m s⁻¹","7.14 × 10¹⁶ m s⁻¹","C","1"
"2019-09","2019","Our Dynamic Universe","The Expanding Universe","The redshift of a distant galaxy is 0.014.<br><br>According to Hubble’s law, the distance of the galaxy from Earth is","","","9.66 × 10⁻¹² m","1.83 × 10²⁴ m","1.30 × 10²⁶ m","9.32 × 10²⁷ m","6.33 × 10³⁹ m","B","1"
"2019-10","2019","Our Dynamic Universe","The Expanding Universe","A student makes the following statements about the Universe.<br>[s]I The force due to gravity acts against the expansion of the Universe.<br>II Measurements show the rate of expansion of the Universe is increasing.<br>III The mass of a galaxy can be estimated by the orbital speed of the stars within the galaxy.[/s]Which of these statements is/are correct?","","","I only","II only","III only","I and II only","I, II and III","E","1"
"2019-11","2019","Particles and Waves","Forces on Charged Particles","An alpha particle is accelerated in an electric field between metal plates P and Q.[c]{{IMAGE}}[/c]<br>The charge on the alpha particle is 3.2 × 10⁻¹⁹ C.<br>The kinetic energy gained by the alpha particle while travelling from plate P to plate Q is 8.0 × 10⁻¹⁶ J.<br><br>The potential difference across plates P and Q is","2019_Q11_Diagram.png","","2.6 × 10⁻³⁴ V","2.0 × 10⁻⁴ V","4.0 × 10⁻⁴ V","2.5 × 10³ V","5.0 × 10³ V","D","1"
"2019-12","2019","Particles and Waves","Forces on Charged Particles","An electron enters a region of uniform magnetic field as shown.[c]{{IMAGE}}[/c]<br>The direction of the magnetic force on the electron immediately after entering the field is","2019_Q12_Diagram.png","","towards the top of the page","towards the bottom of the page","towards the right of the page","into the page","out of the page","A","1"
"2019-13","2019","Particles and Waves","The Standard Model","A student makes the following statements about the Standard Model.<br>[s]I Every particle has an antiparticle.<br>II Alpha decay is evidence for the existence of the neutrino.<br>III The W-boson is associated with the strong nuclear force.[/s]Which of these statements is/are correct?","","","I only","II only","III only","I and II only","I and III only","A","1"
"2019-14","2019","Particles and Waves","Nuclear Reactions","A nucleus represented by \(^{223}_{87} \text{Fr}\) decays by beta emission.<br><br>The symbol representing the nucleus formed as a result of this decay is","","","$${}_{87}^{224}\text{Fr}$$","$${}_{87}^{222}\text{Fr}$$","$${}_{88}^{223}\text{Ra}$$","$${}_{86}^{223}\text{Rn}$$","$${}_{88}^{224}\text{Ra}$$","C","1"
"2019-15","2019","Particles and Waves","Wave-Particle Duality","The diagram shows an experiment set up to investigate the photoelectric effect.<br>The frequency of the incident radiation is varied and the current in the circuit is measured.[c]{{IMAGE}}[/c]<br>Which graph shows the relationship between the current \( I \) in the circuit and the frequency \( f \) of the incident radiation?","2019_Q15_Diagram.png","","[IMG]2019_Q15_A.png","[IMG]2019_Q15_B.png","[IMG]2019_Q15_C.png","[IMG]2019_Q15_D.png","[IMG]2019_Q15_E.png","E","1"
"2019-16","2019","Particles and Waves","Wave-Particle Duality","A photon of energy 6.40 × 10⁻¹⁹ J is incident on a metal plate.<br>This causes photoemission to take place.<br><br>The work function of the metal is 4.20 × 10⁻¹⁹ J.<br><br>The maximum speed of the photoelectron is","","","1.19 × 10⁶ m s⁻¹","9.60 × 10⁵ m s⁻¹","6.95 × 10⁵ m s⁻¹","6.79 × 10⁵ m s⁻¹","4.91 × 10⁵ m s⁻¹","C","1"
"2019-17","2019","Particles and Waves","Interference","Waves from two coherent sources, S₁ and S₂, produce an interference pattern.<br>Maxima are detected at the positions shown.[c]{{IMAGE}}[/c]<br>The wavelength of the waves is 28 mm.<br>For the third minimum at P the path difference (S₂P − S₁P) is","2019_Q17_Diagram.png","","42 mm","56 mm","70 mm","84 mm","98 mm","C","1"
"2019-18","2019","Particles and Waves","Refraction of Light","A ray of monochromatic light passes from air into water.<br>The wavelength of this light in air is 589 nm.<br><br>The speed of this light in water is","","","2.56 × 10² m s⁻¹","4.52 × 10² m s⁻¹","2.26 × 10⁸ m s⁻¹","3.00 × 10⁸ m s⁻¹","3.99 × 10⁸ m s⁻¹","C","1"
"2019-19","2019","Particles and Waves","Spectra","When light passes through the outer layers of the Sun certain frequencies of light are absorbed by hydrogen atoms, producing dark lines in the spectrum.<br><br>The diagram represents some of the energy levels for a hydrogen atom.[c]{{IMAGE}}[/c]The number of absorption lines in the spectrum caused by the transition of electrons between these energy levels is","2019_Q19_Diagram.png","","4","6","9","10","20","D","1"
"2019-20","2019","Electricity","Monitoring and Measuring AC","The output from an AC power supply is connected to an oscilloscope. The trace seen on the oscilloscope screen is shown.[c]{{IMAGE}}[/c]<br>The Y-gain setting on the oscilloscope is 1.0 V/div.<br><br>The rms voltage of the power supply is","2019_Q20_Diagram.png","","2.1 V","3.0 V","4.0 V","4.2 V","6.0 V","A","1"
"2019-21","2019","Electricity","Monitoring and Measuring AC","The output from a signal generator is connected to an oscilloscope. The trace observed on the oscilloscope screen is as shown in the diagram.[c]{{IMAGE}}[/c]The frequency of the signal from the signal generator is now doubled.<br>The amplitude of the signal is unchanged.<br>The Y-gain setting on the oscilloscope is unchanged.<br>The timebase setting on the oscilloscope is changed from 1.0 ms/division to 0.5 ms/division.<br><br>Which of the following diagrams shows the trace that is now observed on the oscilloscope screen?","2019_Q21_Diagram.png","","[IMG]2019_Q21_A.png","[IMG]2019_Q21_B.png","[IMG]2019_Q21_C.png","[IMG]2019_Q21_D.png","[IMG]2019_Q21_E.png","B","1"
"2019-22","2019","Other","Uncertainties","A student sets up a circuit and measures the voltage across and the current in a resistor. The measurements and their uncertainties are<br>[s]voltage = (10.0 ± 0.1) V<br>current = (0.50 ± 0.01) A[/s]The approximate absolute uncertainty in the calculated value of the resistance of the resistor is","","","±0.11 Ω","±0.2 Ω","±0.4 Ω","±1 Ω","±2 Ω","C","1"
"2019-23","2019","Electricity","P,V,I,R","A circuit is set up as shown.[c]{{IMAGE}}[/c]The power supply has negligible internal resistance.<br><br>The power dissipated in the 3.0 Ω resistor is","2019_Q23_Diagram.png","","3.0 W","6.0 W","9.0 W","12 W","18 W","D","1"
"2019-24","2019","Electricity","Semiconductors and p-n Junctions","A student connects four identical light emitting diodes (LEDs) to a 2 V DC supply as shown.[c]{{IMAGE}}[/c]<br>Which of the LEDs P, Q, R, and S will light?","2019_Q24_Diagram.png","","P only","Q only","P and Q only","P and R only","Q and S only","B","1"
"2019-25","2019","Other","Uncertainties","A student makes the following statements about uncertainties.<br>[s]I All measurements of physical quantities are liable to uncertainties.<br>II Random uncertainties occur when a measurement is repeated and slight variations occur.<br>III Systematic uncertainties in a quantity occur when measurements are either all smaller or all larger than the true value of the quantity.[/s]<br>Which of these statements is/are correct?","","","I only","I and II only","I and III only","II and III only","I, II and III","E","1"
"2018-01","2018","Our Dynamic Universe","Motion: Equations & Graphs","A car is moving at a speed of 2.0 m s⁻¹.<br>The car now accelerates at 4.0 m s⁻² until it reaches a speed of 14 m s⁻¹.<br><br>The distance travelled by the car during this acceleration is","","","1.5 m","18 m","24 m","25 m","48 m","C","1"
"2018-02","2018","Our Dynamic Universe","Motion: Equations & Graphs","A ball is dropped from rest and allowed to bounce several times.<br>The graph shows how the velocity of the ball varies with time.[c]{{IMAGE}}[/c]A student makes the following statements about the ball.<br>[s]I The ball hits the ground at P.<br>II The ball is moving upwards between Q and R.<br>III The ball is moving upwards between R and S.[/s]Which of these statements is/are correct?","2018_Q02_Diagram.png","","I only","II only","III only","I and II only","I and III only","D","1"
"2018-03","2018","Our Dynamic Universe","Forces, Energy & Power","A block of mass 6.0 kg and a block of mass 8.0 kg are connected by a string. A force of 32 N is applied to the blocks as shown.[c]{{IMAGE}}[/c]A frictional force of 4.0 N acts on each block.<br><br>The acceleration of the 6.0 kg block is","2018_Q03_Diagram.png","","1.7 m s⁻²","2.0 m s⁻²","2.3 m s⁻²","2.9 m s⁻²","5.3 m s⁻²","A","1"
"2018-04","2018","Our Dynamic Universe","Forces, Energy & Power","A person stands on a weighing machine in a lift. When the lift is at rest, the reading on the weighing machine is 700 N.<br><br>The lift now descends and its speed increases at a constant rate.<br><br>The reading on the weighing machine","","","is a constant value higher than 700 N","is a constant value lower than 700 N","continually increases from 700 N","continually decreases from 700 N","remains constant at 700 N","B","1"
"2018-05","2018","Our Dynamic Universe","Gravitation","Enceladus is a moon of Saturn. The mass of Enceladus is 1.08 × 10²⁰ kg.<br>The mass of Saturn is 5.68 × 10²⁶ kg.<br>The gravitational force of attraction between Enceladus and Saturn is 7.24 × 10¹⁹ N.<br><br>The orbital radius of Enceladus around Saturn is","","","2.38 × 10⁸ m","9.11 × 10¹³ m","5.65 × 10¹⁶ m","8.30 × 10²⁷ m","3.19 × 10³³ m","A","1"
"2018-06","2018","Our Dynamic Universe","Special Relativity","A spacecraft is travelling at 0.10c relative to a star.<br><br>An observer on the spacecraft measures the speed of light emitted by the star to be","","","0.90 c","0.99 c","1.00 c","1.01 c","1.10 c","C","1"
"2018-07","2018","Our Dynamic Universe","Special Relativity","A spacecraft is travelling at a speed of 0.200c relative to the Earth.<br>The spacecraft emits a signal for 20.0 seconds as measured in the frame of reference of the spacecraft.<br><br>An observer on Earth measures the duration of the signal as","","","19.2 s","19.6 s","20.0 s","20.4 s","20.8 s","D","1"
"2018-08","2018","Particles and Waves","The Standard Model","How many types of quark are there?","","","8","6","4","3","2","B","1"
"2018-09","2018","Particles and Waves","The Standard Model","An electron is a","","","boson","hadron","baryon","meson","lepton","E","1"
"2018-10","2018","Particles and Waves","Forces on Charged Particles","A proton enters a region of magnetic field as shown.[c]{{IMAGE}}[/c]On entering the magnetic field the proton","2018_Q10_Diagram.png","","deflects into the page","deflects out of the page","deflects towards the top of the page","deflects towards the bottom of the page","is not deflected","C","1"
"2018-11","2018","Particles and Waves","Nuclear Reactions","A nuclear fission reaction is represented by the following statement.<br>$${}_{0}^{1}n + {}_{92}^{235}U \rightarrow {}_{56}^{141}Ba + X + 3{}_{0}^{1}n$$<br>The nucleus represented by X is","","","$${}_{40}^{96}Zr$$","$${}_{36}^{92}Kr$$","$${}_{40}^{97}Zr$$","$${}_{36}^{93}Kr$$","$${}_{40}^{94}Zr$$","B","1"
"2018-12","2018","Particles and Waves","Inverse Square Law","The irradiance on a surface 0.50 m from a point source of light is \( I \).<br><br>The irradiance on a surface 1.5 m from this source is","","","0.11 I","0.33 I","1.5 I","3.0 I","9.0 I","A","1"
"2018-13","2018","Particles and Waves","Interference","Waves from two coherent sources, S₁ and S₂, produce an interference pattern. Maxima are detected at the positions shown below.[c]{{IMAGE}}[/c]The path difference S₁P − S₂P is 154 mm.<br><br>The wavelength of the waves is","2018_Q13_Diagram.png","","15.4 mm","25.7 mm","28.0 mm","30.8 mm","34.2 mm","D","1"
"2018-14","2018","Particles and Waves","Refraction of Light","A ray of monochromatic light passes from air into a block of glass as shown.[c]{{IMAGE}}[/c]<br>The wavelength of this light in air is 6.30 × 10⁻⁷ m.<br>The refractive index of the glass for this light is 1.50.<br><br>The frequency of this light in the glass is","2018_Q14_Diagram.png","","2.10 × 10⁻¹⁵ Hz","1.26 × 10² Hz","1.89 × 10² Hz","4.76 × 10¹⁴ Hz","7.14 × 10¹⁴ Hz","D","1"
"2018-15","2018","Electricity","P,V,I,R","A circuit is set up as shown.[c]{{IMAGE}}[/c]The battery has negligible internal resistance.<br>A student makes the following statements about the readings on the meters in this circuit.<br>[s]I When switch S is open the reading on the voltmeter will be 6.0 V.<br>II When switch S is open the reading on A2 will be 0.60 A.<br>III When switch S is closed the reading on A1 will be 0.80 A.[/s]Which of these statements is/are correct?","2018_Q15_Diagram.png","","I only","II only","I and II only","II and III only","I, II and III","E","1"
"2018-16","2018","Electricity","P,V,I,R","The power dissipated in a 120 Ω resistor is 4.8 W.<br><br>The current in the resistor is","","","0.020 A","0.040 A","0.20 A","5.0 A","25 A","C","1"
"2018-17","2018","Electricity","Capacitors","A 24.0 μF capacitor is charged until the potential difference across it is 125 V.<br><br>The charge stored on the capacitor is","","","5.21 × 10⁶ C","7.75 × 10⁻² C","1.50 × 10⁻³ C","3.00 × 10⁻³ C","1.92 × 10⁻⁷ C","D","1"
"2018-18","2018","Electricity","Capacitors","A circuit is set up as shown.[c]{{IMAGE}}[/c]When the capacitor is fully charged the energy stored in the capacitor is","2018_Q18_Diagram.png","","1.6 × 10⁻⁵ J","1.3 × 10⁻³ J","2.6 × 10⁻³ J","1.6 × 10⁻² J","1.6 × 10⁴ J","D","1"
"2018-19","2018","Electricity","Capacitors","The circuit shown is used to charge and then discharge a capacitor C.[c]{{IMAGE}}[/c]Which pair of graphs shows how the potential difference \( V \) across the capacitor varies with time \( t \) during charging and discharging?","2018_Q19_Diagram.png","","[IMG]2018_Q19_A.png","[IMG]2018_Q19_B.png","[IMG]2018_Q19_C.png","[IMG]2018_Q19_D.png","[IMG]2018_Q19_E.png","E","1"
"2018-20","2018","Other","Uncertainties","A student carries out an experiment to determine the specific heat capacity \( c \) of a solid.<br>The relationship used to calculate \( c \) is<br>$$c = \frac{E}{m \Delta T}$$The recorded measurements and their percentage uncertainties are shown.<br>[s]energy supplied, \( E \) = 5000 J ± 1%<br>mass of solid, \( m \) = 0.20 kg ± 2%<br>change in temperature, \( \Delta T \) = 4.5 °C ± 5%[/s]A good estimate of the percentage uncertainty in the calculated value of \( c \) is","","","8%","7%","5%","3%","1%","C","1"
"2017-01","2017","Our Dynamic Universe","Motion: Equations & Graphs","The graph shows how the velocity of an object varies with time.[c]{{IMAGE}}[/c]The acceleration of the object is","2017_Q01_Diagram.png","","0.83 m s⁻²","1.2 m s⁻²","2.5 m s⁻²","5.0 m s⁻²","6.0 m s⁻²","A","1"
"2017-02","2017","Our Dynamic Universe","Forces, Energy & Power","A block is resting on a horizontal surface.<br>A force of 24 N is now applied as shown and the block slides along the surface.[c]{{IMAGE}}[/c]<br>The mass of the block is 20 kg.<br>The acceleration of the block is 0.20 m s⁻².<br><br>The force of friction acting on the block is","2017_Q02_Diagram.png","","4.0 N","8.0 N","12 N","16 N","25 N","B","1"
"2017-03","2017","Our Dynamic Universe","Gravitation","The graph shows how the vertical speed of a skydiver varies with time.[c]{{IMAGE}}[/c]A student uses information from the graph to make the following statements.[s]I The acceleration of the skydiver is greatest between P and Q.<br>II The air resistance acting on the skydiver between Q and R is less than the weight of the skydiver.<br>III The forces acting on the skydiver are balanced between R and S.[/s]Which of these statements is/are correct?","2017_Q03_Diagram.png","","I only","II only","III only","I and II only","I, II and III","C","1"
"2017-04","2017","Our Dynamic Universe","Special Relativity","A spacecraft is travelling at a constant speed of 2.75 × 10⁸ m s⁻¹ relative to a planet.<br>A technician on the spacecraft measures the length of the spacecraft as 125 m.<br><br>An observer on the planet measures the length of the spacecraft as","","","36 m","50 m","124 m","314 m","433 m","B","1"
