"id","year","unit","topic","question_text","question_image","table_headers","option_a","option_b","option_c","option_d","option_e","correct_answer","tagged"
"2017-05","2017","Our Dynamic Universe","Special Relativity","A galaxy has a recessional velocity of 0.30c.<br><br>Hubble’s Law predicts that the distance between Earth and this galaxy is","","","1.3 × 10¹⁷ m","3.9 × 10²⁵ m","1.3 × 10²⁶ m","1.4 × 10⁴¹ m","4.5 × 10⁴² m","B","1"
"2017-06","2017","Our Dynamic Universe","The Expanding Universe","Measurements of the expansion rate of the Universe lead to the conclusion that the rate of expansion is increasing.<br>Present theory proposes that this is due to","","","redshift","dark matter","dark energy","the gravitational force","cosmic microwave background radiation","C","1"
"2017-07","2017","Our Dynamic Universe","The Expanding Universe","A student makes the following statements about the radiation emitted by stellar objects.<br>[s]I Stellar objects emit radiation over a wide range of frequencies.<br>II The peak wavelength of radiation is longer for hotter objects than for cooler objects.<br>III At all frequencies, hotter objects emit more radiation per unit surface area per unit time than cooler objects.[/s]Which of these statements is/are correct?","","","I only","III only","I and II only","I and III only","I, II and III","D","1"
"2017-08","2017","Particles and Waves","Nuclear Reactions","The following statement represents a nuclear reaction.<br>$${}_{103}^{256}Lr \rightarrow Z + {}_{2}^{4}He$$Nucleus Z is","","","$${}_{101}^{252}Md$$","$${}_{101}^{252}No$$","$${}_{101}^{256}Md$$","$${}_{105}^{260}Db$$","$${}_{103}^{252}Lr$$","A","1"
"2017-09","2017","Particles and Waves","Wave-Particle Duality","Radiation is incident on a clean zinc plate causing photoelectrons to be emitted.<br><br>The source of radiation is replaced with one emitting radiation of a higher frequency.<br>The irradiance of the radiation incident on the plate remains unchanged.<br><br>Which row in the table shows the effect of this change on the maximum kinetic energy of a photoelectron and the number of photoelectrons emitted per second?","","Maximum kinetic energy of a photoelectron | Number of photoelectrons emitted per second","no change | no change","no change | increases","increases | no change","increases | decreases","decreases | increases","D","1"
"2017-10","2017","Particles and Waves","Wave-Particle Duality","Ultraviolet radiation of frequency 7.70 × 10¹⁴ Hz is incident on the surface of a metal.<br>Photoelectrons are emitted from the surface of the metal.<br>The maximum kinetic energy of an emitted photoelectron is 2.67 × 10⁻¹⁹ J.<br><br>The work function of the metal is","","","1.07 × 10⁻¹⁹ J","2.44 × 10⁻¹⁹ J","2.67 × 10⁻¹⁹ J","5.11 × 10⁻¹⁹ J","7.78 × 10⁻¹⁹ J","B","1"
"2017-11","2017","Particles and Waves","Interference","A student makes the following statements about waves from coherent sources.<br>[s]I Waves from coherent sources have the same velocity.<br>II Waves from coherent sources have the same wavelength.<br>III Waves from coherent sources have a constant phase relationship.[/s]Which of these statements is/are correct?","","","I only","II only","I and II only","I and III only","I, II and III","E","1"
"2017-12","2017","Particles and Waves","Refraction of Light","A ray of red light passes from a liquid to a transparent solid.<br>The solid and the liquid have the same refractive index for this light.<br><br>Which row in the table shows what happens to the speed and wavelength of the light as it passes from the liquid into the solid?","","Speed | Wavelength","decreases | decreases","decreases | increases","no change | increases","increases | no change","no change | no change","E","1"
"2017-13","2017","Particles and Waves","Refraction of Light","A ray of blue light passes from air into a transparent block as shown.[c]{{IMAGE}}[/c]The speed of this light in the block is","2017_Q13_Diagram.png","","1.80 × 10⁸ m s⁻¹","1.96 × 10⁸ m s⁻¹","2.00 × 10⁸ m s⁻¹","2.23 × 10⁸ m s⁻¹","2.65 × 10⁸ m s⁻¹","D","1"
"2017-14","2017","Particles and Waves","Inverse Square Law","A student carries out an experiment to investigate how irradiance varies with distance.<br>A small lamp is placed at a distance \( d \) away from a light meter. The irradiance \( I \) at this distance is displayed on the meter. This measurement is repeated for a range of different distances.<br>The student uses these results to produce the graph shown.[c]{{IMAGE}}[/c]<br>The graph indicates that there is a systematic uncertainty in this experiment.<br><br>Which of the following would be most likely to reduce the systematic uncertainty in this experiment?","2017_Q14_Diagram.png","","Repeating the readings and calculating mean values.","Replacing the small lamp with a larger lamp.","Decreasing the brightness of the lamp.","Repeating the experiment in a darkened room.","Increasing the range of distances.","D","1"
"2017-15","2017","Particles and Waves","Inverse Square Law","A point source of light is 8.00 m away from a surface. The irradiance, due to the point source, at the surface is 50.0 mW m⁻².<br>The point source is now moved to a distance of 12.0 m from the surface.<br><br>The irradiance, due to the point source, at the surface is now","","","22.2 mW m⁻²","26.0 mW m⁻²","33.3 mW m⁻²","75.0 mW m⁻²","267 mW m⁻²","A","1"
"2017-16","2017","Electricity","Monitoring and Measuring AC","The output from an a.c. power supply is connected to an oscilloscope. The trace seen on the oscilloscope screen is shown.[c]{{IMAGE}}[/c]The Y-gain setting on the oscilloscope is 1.0 V/div.<br><br>The r.m.s. voltage of the power supply is","2017_Q16_Diagram.png","","2.1 V","3.0 V","4.0 V","4.2 V","6.0 V","A","1"
"2017-17","2017","Electricity","Capacitors","A 20 µF capacitor is connected to a 12 V d.c. supply.<br><br>The maximum charge stored on the capacitor is","","","1.4 × 10⁻³ C","2.4 × 10⁻⁴ C","1.4 × 10⁻⁴ C","1.7 × 10⁻⁶ C","6.0 × 10⁻⁷ C","B","1"
"2017-18","2017","Electricity","Capacitors","A circuit containing a capacitor is set up as shown.[c]{{IMAGE}}[/c]The supply has negligible internal resistance.<br><br>The maximum energy stored in the capacitor is","2017_Q18_Diagram.png","","5.4 × 10⁻⁴ J","3.5 × 10⁻⁴ J","1.4 × 10⁻⁴ J","3.4 × 10⁻⁵ J","2.2 × 10⁻⁵ J","E","1"
"2017-19","2017","Electricity","Semiconductors and p-n Junctions","A student makes the following statements about conductors, insulators and semiconductors.<br>[s]I In conductors, the conduction band is completely filled with electrons.<br>II In insulators, the gap between the valence band and the conduction band is large.<br>III In semiconductors, increasing the temperature increases the conductivity.[/s]Which of these statements is/are correct?","","","I only","II only","III only","I and II only","II and III only","E","1"
"2017-20","2017","Other","Skills","Astronomers use the following relationship to determine the distance, \( d \), to a star.<br>$$F = \frac{L}{4\pi d^2}$$For a particular star the following measurements are recorded:<br>[s]apparent brightness, \( F = 4.4 \times 10^{-10} \text{ W m}^{-2} \)<br>luminosity, \( L = 6.1 \times 10^{30} \text{ W} \)[/s]Based on this information, the distance to this star is","","","3.3 × 10¹⁹ m","1.5 × 10²¹ m","3.7 × 10³⁶ m","1.1 × 10³⁹ m","3.9 × 10³⁹ m","A","1"
"2016-01","2016","Our Dynamic Universe","Motion: Equations & Graphs","A car accelerates uniformly from rest. The car travels a distance of 60 m in 6.0 s.<br><br>The acceleration of the car is","","","0.83 m s⁻²","3.3 m s⁻²","5.0 m s⁻²","10 m s⁻²","20 m s⁻²","B","1"
"2016-02","2016","Our Dynamic Universe","Motion: Equations & Graphs","A ball is thrown vertically upwards and falls back to Earth.<br><br>Neglecting air resistance, which velocity-time graph represents its motion?","","","[IMG]2016_Q02_A.png","[IMG]2016_Q02_B.png","[IMG]2016_Q02_C.png","[IMG]2016_Q02_D.png","[IMG]2016_Q02_E.png","A","1"
"2016-03","2016","Our Dynamic Universe","Forces, Energy & Power","A block of wood slides with a constant velocity down a slope. The slope makes an angle of 30º with the horizontal as shown. The mass of the block is 2.0 kg.[c]{{IMAGE}}[/c]The magnitude of the force of friction acting on the block is","2016_Q03_Diagram.png","","1.0 N","1.7 N","9.8 N","17.0 N","19.6 N","C","1"
"2016-04","2016","Our Dynamic Universe","Collisions, Explosions & Impulse","The graph shows the force which acts on an object over a time interval of 8.0 seconds.[c]{{IMAGE}}[/c]The momentum gained by the object during this 8.0 seconds is","2016_Q04_Diagram.png","","12 kg m s⁻¹","32 kg m s⁻¹","44 kg m s⁻¹","52 kg m s⁻¹","72 kg m s⁻¹","C","1"
"2016-05","2016","Our Dynamic Universe","Gravitation","A planet orbits a star at a distance of 3.0 × 10⁹ m.<br>The star exerts a gravitational force of 1.6 × 10²⁷ N on the planet.<br>The mass of the star is 6.0 × 10³⁰ kg.<br><br>The mass of the planet is","","","2.4 × 10¹⁴ kg","1.2 × 10¹⁶ kg","3.6 × 10²⁵ kg","1.6 × 10²⁶ kg","2.4 × 10³⁷ kg","C","1"
"2016-06","2016","Our Dynamic Universe","The Expanding Universe","A car horn emits a sound with a constant frequency of 405 Hz.<br>The car is travelling away from a student at 28.0 m s⁻¹.<br>The speed of sound in air is 335 m s⁻¹.<br><br>The frequency of the sound from the horn heard by the student is","","","371 Hz","374 Hz","405 Hz","439 Hz","442 Hz","B","1"
"2016-07","2016","Our Dynamic Universe","The Expanding Universe","The graphs show how the radiation per unit surface area, \( R \), varies with the wavelength, \( \lambda \), of the emitted radiation for two stars, P and Q.[c]{{IMAGE}}[/c]<br>A student makes the following conclusions based on the information in the graph.<br>[s]I Star P is hotter than star Q.<br>II Star P emits more radiation per unit surface area than star Q.<br>III The peak intensity of the radiation from star Q is at a shorter wavelength than that from star P.[/s]Which of these statements is/are correct?","2016_Q07_Diagram.png","","I only","II only","III only","I and II only","II and III only","C","1"
"2016-08","2016","Particles and Waves","The Standard Model","One type of hadron consists of two down quarks and one up quark.<br>The charge on a down quark is -1/3.<br>The charge on an up quark is +2/3.<br><br>Which row in the table shows the charge and type for this hadron?","","charge | type of hadron","0 | baryon","+1 | baryon","-1 | meson","0 | meson","+1 | meson","A","1"
"2016-09","2016","Particles and Waves","The Standard Model","A student makes the following statements about sub-nuclear particles.<br>[s]I The force mediating particles are bosons.<br>II Gluons are the mediating particles of the strong force.<br>III Photons are the mediating particles of the electromagnetic force.[/s]Which of these statements is/are correct?","","","I only","II only","I and II only","II and III only","I, II and III","E","1"
"2016-10","2016","Particles and Waves","Nuclear Reactions","The last two changes in a radioactive decay series are shown below.<br>A Bismuth nucleus emits a beta particle and its product, a Polonium nucleus, emits an alpha particle.<br>$${}_{Q}^{P}\text{Bi} \xrightarrow{\beta} {}_{S}^{R}\text{Po} \xrightarrow{\alpha} {}_{82}^{208}\text{Pb}$$Which numbers are represented by P, Q, R and S?","","P | Q | R | S","210 | 83 | 208 | 81","210 | 83 | 210 | 84","211 | 85 | 207 | 86","212 | 83 | 212 | 84","212 | 85 | 212 | 84","D","1"
"2016-11","2016","Particles and Waves","Wave-Particle Duality","The table below shows the threshold frequency of radiation for photoelectric emission for some metals.[t]Metal | Threshold frequency (Hz)<br>sodium | 4.4 × 10¹⁴<br>potassium | 5.4 × 10¹⁴<br>zinc | 6.9 × 10¹⁴[/t]<br>Radiation of frequency 6.3 × 10¹⁴ Hz is incident on the surface of each of the metals.<br><br>Photoelectric emission occurs from","","","sodium only","zinc only","potassium only","sodium and potassium only","zinc and potassium only","D","1"
"2016-12","2016","Particles and Waves","Wave-Particle Duality","Radiation of frequency 9.00 × 10¹⁵ Hz is incident on a clean metal surface.<br>The maximum kinetic energy of a photoelectron ejected from this surface is 5.70 × 10⁻¹⁸ J.<br><br>The work function of the metal is","","","2.67 × 10⁻¹⁹ J","5.97 × 10⁻¹⁸ J","1.17 × 10⁻¹⁷ J","2.07 × 10⁻² J","9.60 × 10⁻¹ J","A","1"
"2016-13","2016","Particles and Waves","Interference","A ray of monochromatic light is incident on a grating as shown.[c]{{IMAGE}}[/c]<br>The wavelength of the light is 633 nm.<br><br>The separation of the slits on the grating is","2016_Q13_Diagram.png","","1.96 × 10⁻⁷ m","1.08 × 10⁻⁶ m","2.05 × 10⁻⁶ m","2.15 × 10⁻⁶ m","4.10 × 10⁻⁶ m","C","1"
"2016-14","2016","Particles and Waves","Refraction of Light","Light travels from glass into air.<br><br>Which row in the table shows what happens to the speed, frequency and wavelength of the light as it travels from glass into air?","","Speed | Frequency | Wavelength","decreases | stays constant | decreases","decreases | increases | stays constant","stays constant | increases | increases","increases | increases | stays constant","increases | stays constant | increases","E","1"
"2016-15","2016","Particles and Waves","Inverse Square Law","The irradiance of light from a point source is 32 W m⁻² at a distance of 4.0 m from the source.<br><br>The irradiance of the light at a distance of 16 m from the source is","","","0.125 W m⁻²","0.50 W m⁻²","2.0 W m⁻²","8.0 W m⁻²","128 W m⁻²","C","1"
"2016-16","2016","Particles and Waves","Spectra","Part of the energy level diagram for an atom is shown[c]{{IMAGE}}[/c]<br>X and Y represent two possible electron transitions.<br>A student makes the following statements about transitions X and Y.<br>[s]I Transition Y produces photons of higher frequency than transition X<br>II Transition X produces photons of longer wavelength than transition Y<br>III When an electron is in the energy level E₀, the atom is ionised.[/s]Which of the statements is/are correct?","2016_Q16_Diagram.png","","I only","I and II only","I and III only","II and III only","I, II and III","B","1"
"2016-17","2016","Electricity","Monitoring and Measuring AC","The output of a signal generator is connected to the input of an oscilloscope.<br>The trace produced on the screen of the oscilloscope is shown.[c]{{IMAGE}}[/c]The timebase control of the oscilloscope is set at 2 ms/div.<br>The Y-gain control of the oscilloscope is set at 4 mV/div.<br><br>Which row in the table shows the frequency and peak voltage of the output of the signal generator?","2016_Q17_Diagram.png","frequency (Hz) | peak voltage (mV)","0.5 | 12","0.5 | 6","250 | 6","500 | 12","500 | 24","D","1"
"2016-18","2016","Electricity","P,V,I,R","A potential divider circuit is set up as shown.[c]{{IMAGE}}[/c]The potential difference across the 7.0 kΩ resistor is","2016_Q18_Diagram.png","","3.6 V","4.0 V","5.1 V","8.4 V","9.0 V","D","1"
"2016-19","2016","Electricity","Electrical Sources and Internal Resistance","A circuit is set up as shown.[c]{{IMAGE}}[/c]The resistance of the variable resistor is increased and corresponding readings on the ammeter are recorded.<br>[t]Resistance (Ω)| 2.0| 4.0| 6.0| 8.0<br>Current (A)| 2.0| 1.5| 1.2| 1.0[/t]These results show that as the resistance of the variable resistor increases the power dissipated in the variable resistor","2016_Q19_Diagram.png","","increases","decreases","remains constant","decreases and then increases","increases and then decreases","E","1"
"2016-20","2016","Electricity","Capacitors","A 20 μF capacitor is connected to a 12 V d.c. supply.<br><br>The maximum charge stored on the capacitor is","","","1.4 × 10⁻³ C","2.4 × 10⁻⁴ C","1.2 × 10⁻⁴ C","1.7 × 10⁻⁶ C","6.0 × 10⁻⁷ C","B","1"
"2015-01","2015","Our Dynamic Universe","Motion: Equations & Graphs","The following velocity-time graph represents the vertical motion of a ball.[c]{{IMAGE}}[/c]Which of the following acceleration-time graphs represents the same motion?","2015_Q01_Diagram.png","","[IMG]2015_Q01_A.png","[IMG]2015_Q01_B.png","[IMG]2015_Q01_C.png","[IMG]2015_Q01_D.png","[IMG]2015_Q01_E.png","C","1"
"2015-02","2015","Our Dynamic Universe","Motion: Equations & Graphs","A car is travelling at 12 m s⁻¹ along a straight road. The car now accelerates uniformly at -1.5 m s⁻² for 6.0 s.<br><br>The distance travelled during this time is","","","18 m","45 m","68 m","72 m","99 m","B","1"
"2015-03","2015","Our Dynamic Universe","Forces, Energy & Power","A box of mass m rests on a slope as shown.[c]{{IMAGE}}[/c]Which row in the table shows the component of the weight acting down the slope and the component of the weight acting normal to the slope?","2015_Q03_Diagram.png","Component of weight acting down the slope | Component of weight acting normal to the slope","mg sinθ | mg cosθ","mg tanθ | mg sinθ","mg cosθ | mg sinθ","mg cosθ | mg tanθ","mg sinθ | mg tanθ","A","1"
"2015-04","2015","Our Dynamic Universe","Forces, Energy & Power","A person stands on bathroom scales in a lift.<br>The scales show a reading greater than the person’s weight.<br><br>The lift is moving","","","upwards with constant speed","downwards with constant speed","downwards with increasing speed","downwards with decreasing speed","upwards with decreasing speed","D","1"
"2015-05","2015","Our Dynamic Universe","Forces, Energy & Power","A car of mass 900 kg pulls a caravan of mass 400 kg along a straight, horizontal road with an acceleration of 2.0 m s⁻².[c]{{IMAGE}}[/c]Assuming that the frictional forces on the caravan are negligible, the tension in the coupling between the car and the caravan is","2015_Q05_Diagram.png","","400 N","500 N","800 N","1800 N","2600 N","C","1"
"2015-06","2015","Our Dynamic Universe","Forces, Energy & Power","Water flows at a rate of 6.25 × 10⁸ kg per minute over a waterfall.<br>The height of the waterfall is 108 m.<br><br>The total power delivered by the water in falling through the 108 m is","","","1.13 × 10⁹ W","1.10 × 10¹⁰ W","6.62 × 10¹¹ W","4.05 × 10¹² W","3.97 × 10¹³ W","B","1"
"2015-07","2015","Our Dynamic Universe","Special Relativity","A spacecraft is travelling at a constant speed of 0.60c relative to the Moon.<br>An observer on the Moon measures the length of the moving spacecraft to be 190 m.<br><br>The length of the spacecraft as measured by an astronaut on the spacecraft is","","","120 m","152 m","238 m","297 m","300 m","C","1"
"2015-08","2015","Our Dynamic Universe","The Expanding Universe","A siren on an ambulance emits sound at a constant frequency of 750 Hz.<br>The ambulance is travelling at a constant speed of 25.0 m s⁻¹ towards a stationary observer.<br>The speed of sound in air is 340 m s⁻¹.<br><br>The frequency of the sound heard by the observer is","","","695 Hz","699 Hz","750 Hz","805 Hz","810 Hz","E","1"
"2015-09","2015","Particles and Waves","The Standard Model","The emission of beta particles in radioactive decay is evidence for the existence of","","","quarks","electrons","gluons","neutrinos","bosons","D","1"
"2015-10","2015","Particles and Waves","Forces on Charged Particles","Two parallel metal plates X and Y in a vacuum have a potential difference V across them.[c]{{IMAGE}}[/c]An electron of charge e and mass m, initially at rest, is released from plate X.<br><br>The speed of the electron when it reaches plate Y is given by","2015_Q10_Diagram.png","","$$ \frac{2eV}{m} $$","$$ \sqrt{\frac{2eV}{m}} $$","$$ \sqrt{\frac{2V}{em}} $$","$$ \frac{2V}{em} $$","$$ \frac{2mV}{e} $$","B","1"
"2015-11","2015","Particles and Waves","Forces on Charged Particles","A potential difference of 2 kV is applied across two metal plates.<br>An electron passes between the metal plates and follows the path shown.[c]{{IMAGE}}[/c]<br>A student makes the following statements about changes that could be made to allow the electron to pass between the plates and reach the screen.<br>[s]I Increasing the initial speed of the electron could allow the electron to reach the screen.<br>II Increasing the potential difference across the plates could allow the electron to reach the screen.<br>III Reversing the polarity of the plates could allow the electron to reach the screen.[/s]Which of these statements is/are correct?","2015_Q11_Diagram.png","","I only","II only","III only","I and II only","I and III only","A","1"
"2015-12","2015","Particles and Waves","Nuclear Reactions","The following statement describes a fusion reaction.<br>$${}_{1}^{2}\text{H} + {}_{1}^{2}\text{H} \rightarrow {}_{2}^{3}\text{He} + {}_{0}^{1}\text{n} + \text{energy}$$<br>The total mass of the particles before the reaction is 6.684 × 10⁻²⁷ kg.<br>The total mass of the particles after the reaction is 6.680 × 10⁻²⁷ kg.<br><br>The energy released in the reaction is","","","6.012 × 10⁻¹⁰ J","6.016 × 10⁻¹⁰ J","1.800 × 10⁻¹³ J","3.600 × 10⁻¹³ J","1.200 × 10⁻²¹ J","D","1"
"2015-13","2015","Particles and Waves","Interference","Two identical loudspeakers, L₁ and L₂, are operated at the same frequency and in phase with each other. An interference pattern is produced.[c]{{IMAGE}}[/c]At position P, which is the same distance from both loudspeakers, there is a maximum.<br>The next maximum is at position R, where L₁R = 5.6 m and L₂R = 5.3 m.<br>The speed of sound in air is 340 m s⁻¹.<br><br>The frequency of the sound emitted by the loudspeakers is","2015_Q13_Diagram.png","","8.8 × 10⁻⁴ Hz","3.1 × 10¹ Hz","1.0 × 10² Hz","1.1 × 10³ Hz","3.7 × 10³ Hz","D","1"
"2015-14","2015","Other","Uncertainties","An experiment is carried out to measure the wavelength of red light from a laser.<br>The following values for the wavelength are obtained.<br><br>[c]650 nm   640 nm   635 nm   648 nm   655 nm[/c]<br>The mean value for the wavelength and the approximate random uncertainty in the mean is","","","(645 ± 1) nm","(645 ± 4) nm","(646 ± 1) nm","(646 ± 4) nm","(3228 ± 20) nm","D","1"
"2015-15","2015","Particles and Waves","Refraction of Light","Red light is used to investigate the critical angle of two materials P and Q.[c]{{IMAGE}}[/c]A student makes the following statements.<br>[s]I Material P has a higher refractive index than material Q.<br>II The wavelength of the red light is longer inside material P than inside material Q.<br>III The red light travels at the same speed inside materials P and Q.[/s]Which of these statements is/are correct?","2015_Q15_Diagram.png","","I only","II only","III only","I and II only","I, II and III","A","1"
"2015-16","2015","Particles and Waves","Spectra","The diagram represents some electron transitions between energy levels in an atom.[c]{{IMAGE}}[/c]The radiation emitted with the shortest wavelength is produced by an electron making transition","2015_Q16_Diagram.png","","E1 to E0","E2 to E1","E3 to E2","E3 to E1","E3 to E0","E","1"
"2015-17","2015","Electricity","Monitoring and Measuring AC","The output from a signal generator is connected to the input terminals of an oscilloscope.<br>The trace observed on the oscilloscope screen, the Y-gain setting and the timebase setting are shown.[c]{{IMAGE}}[/c]The frequency of the signal shown is calculated using the","2015_Q17_Diagram.png","","timebase setting and the vertical height of the trace","timebase setting and the horizontal distance between the peaks of the trace","Y-gain setting and the vertical height of the trace","Y-gain setting and the horizontal distance between the peaks of the trace","Y-gain setting and the timebase setting","B","1"
"2015-18","2015","Electricity","Monitoring and Measuring AC","A circuit is set up as shown.[c]{{IMAGE}}[/c]The r.m.s voltage across the lamp is 12 V.<br>The power produced by the lamp is 24 W.<br><br>The peak current in the lamp is","2015_Q18_Diagram.png","","0.71 A","1.4 A","2.0 A","2.8 A","17 A","D","1"
"2015-19","2015","Electricity","Semiconductors and p-n Junctions","A student makes the following statements about energy bands in different materials.<br>[s]I In metals the highest occupied energy band is not completely full.<br>II In insulators the highest occupied energy band is full.<br>III The gap between the valence band and conduction band is smaller in semiconductors than in insulators.[/s]Which of these statements is/are correct?","","","I only","II only","I and II only","I and III only","I, II and III","E","1"
"2015-20","2015","Other","Skills","[s][/s]The upward lift force \( L \) on the wings of an aircraft is calculated using the relationship<br>$$L = \frac{1}{2}\rho v^2 A C_L$$where:<br>[s]\( \rho \) is the density of air<br>\( v \) is the speed of the wings through the air<br>\( A \) is the area of the wings<br>\( C_L \) is the coefficient of lift.[/s]The weight of a model aircraft is 80.0 N.<br>The area of the wings on the model aircraft is 3.0 m².<br>The coefficient of lift for these wings is 1.6.<br>The density of air is 1.29 kg m⁻³<br><br>The speed required for the model aircraft to maintain a level flight is","","","2.5 m s⁻¹","3.6 m s⁻¹","5.1 m s⁻¹","12.9 m s⁻¹","25.8 m s⁻¹","C","1"